source,author,title,description,url,urlToImage,publishedAt,content,Full Description
ETF Daily News,MarketBeat News,"Fmr LLC Decreases Holdings in Alexandria Real Estate Equities, Inc. (NYSE:ARE)","Fmr LLC lessened its stake in Alexandria Real Estate Equities, Inc. (NYSE:ARE – Free Report) by 21.9% in the third quarter, HoldingsChannel reports. The fund owned 419,328 shares of the real estate investment trust’s stock after selling 117,264 shares during …",https://www.etfdailynews.com/2024/12/08/fmr-llc-decreases-holdings-in-alexandria-real-estate-equities-inc-nyseare/,https://www.americanbankingnews.com/wp-content/timthumb/timthumb.php?src=https://www.marketbeat.com/logos/alexandria-real-estate-equities-inc-logo-1200x675.jpg&w=240&h=240&zc=2,2024-12-08T08:30:49Z,"Fmr LLC lessened its stake in Alexandria Real Estate Equities, Inc. (NYSE:ARE – Free Report) by 21.9% in the third quarter, HoldingsChannel reports. The fund owned 419,328 shares of the real estate i… [+5590 chars]","Fmr LLC Decreases Holdings in Alexandria Real Estate Equities, Inc. (NYSE:ARE) - ETF Daily News Skip to main content ☰ Analyst Ratings Crypto Earnings Insider Trades IPOs Options Analyst Ratings Crypto Earnings Insider Trades IPOs Options Fmr LLC Decreases Holdings in Alexandria Real Estate Equities, Inc. (NYSE:ARE) Posted by MarketBeat News on Dec 8th, 2024 Share on Twitter Share on Facebook Share on LinkedIn Share on Stocktwits Fmr LLC lessened its stake in Alexandria Real Estate Equities, Inc. ( NYSE:ARE – Free Report ) by 21.9% in the third quarter, HoldingsChannel reports. The fund owned 419,328 shares of the real estate investment trust’s stock after selling 117,264 shares during the period. Fmr LLC’s holdings in Alexandria Real Estate Equities were worth $49,795,000 at the end of the most recent quarter. Several other hedge funds and other institutional investors have also recently bought and sold shares of ARE. The Manufacturers Life Insurance Company lifted its stake in Alexandria Real Estate Equities by 0.8% in the third quarter. The Manufacturers Life Insurance Company now owns 121,648 shares of the real estate investment trust’s stock worth $14,446,000 after acquiring an additional 948 shares during the period. Bank of Montreal Can boosted its holdings in Alexandria Real Estate Equities by 15.5% in the third quarter. Bank of Montreal Can now owns 361,412 shares of the real estate investment trust’s stock worth $43,738,000 after acquiring an additional 48,622 shares in the last quarter. Capital Square LLC increased its stake in Alexandria Real Estate Equities by 2.1% during the 3rd quarter. Capital Square LLC now owns 5,811 shares of the real estate investment trust’s stock valued at $690,000 after purchasing an additional 118 shares in the last quarter. Private Trust Co. NA increased its position in shares of Alexandria Real Estate Equities by 113.6% during the third quarter. Private Trust Co. NA now owns 596 shares of the real estate investment trust’s stock valued at $71,000 after acquiring an additional 317 shares in the last quarter. Finally, Truvestments Capital LLC raised its stake in shares of Alexandria Real Estate Equities by 3.3% in the third quarter. Truvestments Capital LLC now owns 22,676 shares of the real estate investment trust’s stock worth $2,693,000 after purchasing an additional 733 shares during the last quarter. Institutional investors own 96.54% of the company’s stock. Get Alexandria Real Estate Equities alerts: Alexandria Real Estate Equities Stock Down 1.5 % Shares of NYSE:ARE opened at $103.85 on Friday. The company has a quick ratio of 0.20, a current ratio of 0.20 and a debt-to-equity ratio of 0.56. Alexandria Real Estate Equities, Inc. has a 52-week low of $102.89 and a 52-week high of $135.45. The business has a fifty day moving average of $112.72 and a two-hundred day moving average of $116.40. The stock has a market cap of $18.15 billion, a P/E ratio of 63.32, a PEG ratio of 3.93 and a beta of 1.14. Want More Great Investing Ideas? 10 Stocks to Sell NOW! 3 Stocks to DOUBLE This Year The 10 Best Stocks to Own in 2023 7 Stocks to Buy and Hold Forever Alexandria Real Estate Equities ( NYSE:ARE – Get Free Report ) last released its quarterly earnings results on Monday, October 21st. The real estate investment trust reported $0.96 EPS for the quarter, missing analysts’ consensus estimates of $2.38 by ($1.42). The firm had revenue of $791.60 million for the quarter, compared to analyst estimates of $766.97 million. Alexandria Real Estate Equities had a return on equity of 1.31% and a net margin of 9.62%. The firm’s revenue for the quarter was up 10.9% on a year-over-year basis. During the same quarter last year, the company earned $2.26 earnings per share. On average, research analysts expect that Alexandria Real Estate Equities, Inc. will post 9.47 earnings per share for the current year. Analysts Set New Price Targets Several equities analysts have recently weighed in on the company. BMO Capital Markets raised Alexandria Real Estate Equities to a “hold” rating in a report on Wednesday, September 25th. Evercore ISI lowered their price objective on Alexandria Real Estate Equities from $129.00 to $124.00 and set an “in-line” rating on the stock in a research report on Wednesday, October 23rd. Robert W. Baird cut their target price on shares of Alexandria Real Estate Equities from $137.00 to $130.00 and set an “outperform” rating for the company in a research note on Friday, November 8th. JPMorgan Chase & Co. downgraded Alexandria Real Estate Equities from an “overweight” rating to a “neutral” rating and reduced their price objective for the stock from $133.00 to $121.00 in a research note on Wednesday, November 27th. Finally, Wedbush restated an “outperform” rating and set a $110.00 target price (down from $120.00) on shares of Alexandria Real Estate Equities in a research report on Friday. Nine research analysts have rated the stock with a hold rating and four have issued a buy rating to the company’s stock. Based on data from MarketBeat, Alexandria Real Estate Equities currently has an average rating of “Hold” and an average target price of $125.82. Read Our Latest Analysis on Alexandria Real Estate Equities Alexandria Real Estate Equities Profile ( Free Report ) Alexandria Real Estate Equities, Inc (NYSE: ARE), an S&P 500 company, is a best-in-class, mission-driven life science REIT making a positive and lasting impact on the world. As the pioneer of the life science real estate niche since our founding in 1994, Alexandria is the preeminent and longest-tenured owner, operator, and developer of collaborative life science, agtech, and advanced technology mega campuses in AAA innovation cluster locations, including Greater Boston, the San Francisco Bay Area, New York City, San Diego, Seattle, Maryland, and Research Triangle. Further Reading Five stocks we like better than Alexandria Real Estate Equities How to Invest in Insurance Companies: A Guide Fast-Growing Companies That Are Still Undervalued Stock Sentiment Analysis: How it Works Top Cybersecurity Stock Picks for 2025 Do ETFs Pay Dividends? What You Need to Know Archer or Joby: Which Aviation Company Might Rise Fastest? Want to see what other hedge funds are holding ARE? Visit HoldingsChannel.com to get the latest 13F filings and insider trades for Alexandria Real Estate Equities, Inc. ( NYSE:ARE – Free Report ). Receive News & Ratings for Alexandria Real Estate Equities Daily - Enter your email address below to receive a concise daily summary of the latest news and analysts' ratings for Alexandria Real Estate Equities and related companies with MarketBeat.com's FREE daily email newsletter . « PREVIOUS HEADLINE Fmr LLC Has $47.15 Million Position in Elanco Animal Health Incorporated (NYSE:ELAN) NEXT HEADLINE » Fmr LLC Has $52.61 Million Holdings in Curtiss-Wright Co. (NYSE:CW) You might be interested in: California Water Service Group Shares Bought by BNP Paribas Financial Markets BNP Paribas Financial Markets Has $1.47 Million Stock Holdings in AAR Corp. Independent Bank Corp. Shares Acquired by BNP Paribas Financial Markets BNP Paribas Financial Markets Has $1.49 Million Holdings in Veritex Holdings, Inc. BNP Paribas Financial Markets Buys 12,653 Shares of IDACORP, Inc. Fmr LLC Trims Position in FMC Co. Daily Ratings & News for Alexandria Real Estate Equities Complete the form below to receive the latest headlines and analysts' recommendations for Alexandria Real Estate Equities with MarketBeat's free daily email newsletter: Follow @etfdailynews Recent News California Water Service Group (NYSE:CWT) Shares Bought by BNP Paribas Financial Markets BNP Paribas Financial Markets Has $1.47 Million Stock Holdings in AAR Corp. (NYSE:AIR) Independent Bank Corp. (NASDAQ:INDB) Shares Acquired by BNP Paribas Financial Markets BNP Paribas Financial Markets Has $1.49 Million Holdings in Veritex Holdings, Inc. (NASDAQ:VBTX) BNP Paribas Financial Markets Buys 12,653 Shares of IDACORP, Inc. (NYSE:IDA) Fmr LLC Trims Position in FMC Co. (NYSE:FMC) BNP Paribas Financial Markets Buys 5,563 Shares of MSC Industrial Direct Co., Inc. (NYSE:MSM) BNP Paribas Financial Markets Has $1.51 Million Holdings in Wyndham Hotels & Resorts, Inc. (NYSE:WH) Fmr LLC Boosts Stock Holdings in Hawkins, Inc. (NASDAQ:HWKN) Fmr LLC Sells 58,746 Shares of Genuine Parts (NYSE:GPC) BNP Paribas Financial Markets Grows Stock Holdings in Pitney Bowes Inc. (NYSE:PBI) BNP Paribas Financial Markets Buys 3,030 Shares of Gravity Co., Ltd. (NASDAQ:GRVY) BNP Paribas Financial Markets Has $1.57 Million Stake in First BanCorp. (NYSE:FBP) BNP Paribas Financial Markets Raises Stock Holdings in Science Applications International Co. (NYSE:SAIC) BNP Paribas Financial Markets Acquires 16,455 Shares of Bank of Hawaii Co. (NYSE:BOH) Hawaiian Electric Industries, Inc. (NYSE:HE) Shares Sold by BNP Paribas Financial Markets Fmr LLC Sells 246,244 Shares of Best Buy Co., Inc. (NYSE:BBY) Fmr LLC Lowers Holdings in Quaker Chemical Co. (NYSE:KWR) Mplx Lp (NYSE:MPLX) Shares Acquired by Fmr LLC Robert W. Baird Forecasts Strong Price Appreciation for DocuSign (NASDAQ:DOCU) Stock © 2018-2024 ETF Daily News"
ETF Daily News,MarketBeat News,"Fmr LLC Raises Stock Position in Cannae Holdings, Inc. (NYSE:CNNE)","Fmr LLC boosted its holdings in shares of Cannae Holdings, Inc. (NYSE:CNNE – Free Report) by 17.6% in the third quarter, HoldingsChannel.com reports. The fund owned 2,653,854 shares of the company’s stock after buying an additional 397,352 shares during the q…",https://www.etfdailynews.com/2024/12/08/fmr-llc-raises-stock-position-in-cannae-holdings-inc-nysecnne/,https://www.americanbankingnews.com/wp-content/timthumb/timthumb.php?src=https://www.marketbeat.com/logos/cannae-holdings-inc-logo-1200x675.png?v=20221128155530&w=240&h=240&zc=2,2024-12-08T08:30:48Z,"Fmr LLC boosted its holdings in shares of Cannae Holdings, Inc. (NYSE:CNNE – Free Report) by 17.6% in the third quarter, HoldingsChannel.com reports. The fund owned 2,653,854 shares of the company’s … [+3960 chars]","Fmr LLC Raises Stock Position in Cannae Holdings, Inc. (NYSE:CNNE) - ETF Daily News Skip to main content ☰ Analyst Ratings Crypto Earnings Insider Trades IPOs Options Analyst Ratings Crypto Earnings Insider Trades IPOs Options Fmr LLC Raises Stock Position in Cannae Holdings, Inc. (NYSE:CNNE) Posted by MarketBeat News on Dec 8th, 2024 Share on Twitter Share on Facebook Share on LinkedIn Share on Stocktwits Fmr LLC boosted its holdings in shares of Cannae Holdings, Inc. ( NYSE:CNNE – Free Report ) by 17.6% in the third quarter, HoldingsChannel.com reports. The fund owned 2,653,854 shares of the company’s stock after buying an additional 397,352 shares during the quarter. Fmr LLC’s holdings in Cannae were worth $50,582,000 at the end of the most recent reporting period. A number of other large investors have also recently bought and sold shares of CNNE. Price T Rowe Associates Inc. MD increased its holdings in shares of Cannae by 3.1% during the 1st quarter. Price T Rowe Associates Inc. MD now owns 43,285 shares of the company’s stock worth $963,000 after buying an additional 1,312 shares during the last quarter. CWM LLC grew its holdings in shares of Cannae by 1,616.0% during the second quarter. CWM LLC now owns 1,390 shares of the company’s stock valued at $25,000 after purchasing an additional 1,309 shares during the last quarter. Shayne & Jacobs LLC increased its position in Cannae by 5.6% in the second quarter. Shayne & Jacobs LLC now owns 86,496 shares of the company’s stock worth $1,569,000 after buying an additional 4,590 shares during the period. Crescent Grove Advisors LLC increased its holdings in shares of Cannae by 0.4% in the 2nd quarter. Crescent Grove Advisors LLC now owns 318,884 shares of the company’s stock worth $5,785,000 after acquiring an additional 1,125 shares during the period. Finally, Innealta Capital LLC bought a new position in Cannae in the 2nd quarter valued at about $48,000. Institutional investors and hedge funds own 88.12% of the company’s stock. Get Cannae alerts: Cannae Stock Performance NYSE:CNNE opened at $20.80 on Friday. The firm has a 50 day moving average of $19.98 and a 200-day moving average of $19.26. The company has a current ratio of 2.55, a quick ratio of 2.55 and a debt-to-equity ratio of 0.10. Cannae Holdings, Inc. has a 1 year low of $16.94 and a 1 year high of $22.99. The stock has a market capitalization of $1.30 billion, a P/E ratio of -4.32 and a beta of 0.85. Want More Great Investing Ideas? 10 Stocks to Sell NOW! 3 Stocks to DOUBLE This Year The 10 Best Stocks to Own in 2023 7 Stocks to Buy and Hold Forever Cannae ( NYSE:CNNE – Get Free Report ) last posted its quarterly earnings data on Tuesday, November 12th. The company reported ($0.22) earnings per share for the quarter, hitting the consensus estimate of ($0.22). The firm had revenue of $113.90 million during the quarter, compared to analysts’ expectations of $105.67 million. Cannae had a negative net margin of 68.61% and a negative return on equity of 8.26%. Cannae’s revenue was down 20.7% on a year-over-year basis. During the same quarter in the previous year, the company posted ($2.18) EPS. As a group, sell-side analysts anticipate that Cannae Holdings, Inc. will post -3.14 EPS for the current fiscal year. Cannae Dividend Announcement The company also recently disclosed a quarterly dividend, which will be paid on Tuesday, December 31st. Investors of record on Tuesday, December 17th will be given a $0.12 dividend. This represents a $0.48 dividend on an annualized basis and a dividend yield of 2.31%. The ex-dividend date is Tuesday, December 17th. Cannae’s dividend payout ratio is currently -9.98%. Analyst Ratings Changes Separately, Royal Bank of Canada lifted their target price on shares of Cannae from $26.00 to $27.00 and gave the stock an “outperform” rating in a research report on Thursday, November 14th. Get Our Latest Stock Report on CNNE Cannae Company Profile ( Free Report ) Cannae Holdings, Inc is a principal investment firm. The firm primarily invests in restaurants, technology enabled healthcare services, financial services and more. It takes both minority and majority stakes. Cannae Holdings, Inc was founded in 2014 and is based in Las Vegas, Nevada. Featured Stories Five stocks we like better than Cannae Earnings Per Share Calculator: How to Calculate EPS Fast-Growing Companies That Are Still Undervalued NYSE Stocks Give Investors a Variety of Quality Options Top Cybersecurity Stock Picks for 2025 3 Stocks to Consider Buying in October Archer or Joby: Which Aviation Company Might Rise Fastest? Want to see what other hedge funds are holding CNNE? Visit HoldingsChannel.com to get the latest 13F filings and insider trades for Cannae Holdings, Inc. ( NYSE:CNNE – Free Report ). Receive News & Ratings for Cannae Daily - Enter your email address below to receive a concise daily summary of the latest news and analysts' ratings for Cannae and related companies with MarketBeat.com's FREE daily email newsletter . « PREVIOUS HEADLINE Northfield Bancorp, Inc. (Staten Island, NY) (NASDAQ:NFBK) Upgraded at StockNews.com NEXT HEADLINE » Fmr LLC Lowers Stock Holdings in ORIC Pharmaceuticals, Inc. (NASDAQ:ORIC) You might be interested in: California Water Service Group Shares Bought by BNP Paribas Financial Markets BNP Paribas Financial Markets Has $1.47 Million Stock Holdings in AAR Corp. Independent Bank Corp. Shares Acquired by BNP Paribas Financial Markets BNP Paribas Financial Markets Has $1.49 Million Holdings in Veritex Holdings, Inc. BNP Paribas Financial Markets Buys 12,653 Shares of IDACORP, Inc. Fmr LLC Trims Position in FMC Co. Daily Ratings & News for Cannae Complete the form below to receive the latest headlines and analysts' recommendations for Cannae with MarketBeat's free daily email newsletter: Follow @etfdailynews Recent News California Water Service Group (NYSE:CWT) Shares Bought by BNP Paribas Financial Markets BNP Paribas Financial Markets Has $1.47 Million Stock Holdings in AAR Corp. (NYSE:AIR) Independent Bank Corp. (NASDAQ:INDB) Shares Acquired by BNP Paribas Financial Markets BNP Paribas Financial Markets Has $1.49 Million Holdings in Veritex Holdings, Inc. (NASDAQ:VBTX) BNP Paribas Financial Markets Buys 12,653 Shares of IDACORP, Inc. (NYSE:IDA) Fmr LLC Trims Position in FMC Co. (NYSE:FMC) BNP Paribas Financial Markets Buys 5,563 Shares of MSC Industrial Direct Co., Inc. (NYSE:MSM) BNP Paribas Financial Markets Has $1.51 Million Holdings in Wyndham Hotels & Resorts, Inc. (NYSE:WH) Fmr LLC Boosts Stock Holdings in Hawkins, Inc. (NASDAQ:HWKN) Fmr LLC Sells 58,746 Shares of Genuine Parts (NYSE:GPC) BNP Paribas Financial Markets Grows Stock Holdings in Pitney Bowes Inc. (NYSE:PBI) BNP Paribas Financial Markets Buys 3,030 Shares of Gravity Co., Ltd. (NASDAQ:GRVY) BNP Paribas Financial Markets Has $1.57 Million Stake in First BanCorp. (NYSE:FBP) BNP Paribas Financial Markets Raises Stock Holdings in Science Applications International Co. (NYSE:SAIC) BNP Paribas Financial Markets Acquires 16,455 Shares of Bank of Hawaii Co. (NYSE:BOH) Hawaiian Electric Industries, Inc. (NYSE:HE) Shares Sold by BNP Paribas Financial Markets Fmr LLC Sells 246,244 Shares of Best Buy Co., Inc. (NYSE:BBY) Fmr LLC Lowers Holdings in Quaker Chemical Co. (NYSE:KWR) Mplx Lp (NYSE:MPLX) Shares Acquired by Fmr LLC Robert W. Baird Forecasts Strong Price Appreciation for DocuSign (NASDAQ:DOCU) Stock © 2018-2024 ETF Daily News"
BBC News,,New images released as hunt for New York shooter continues,New York police are still searching for the gunman who killed UnitedHealthcare boss Brian Thompson.,https://www.bbc.com/news/articles/cpw22ger4gjo,https://ichef.bbci.co.uk/news/1024/branded_news/b42c/live/a100f7a0-b524-11ef-a0f2-fd81ae5962f4.jpg,2024-12-08T08:30:19Z,"Police have released two new images of a suspect in the hunt for the gunman who killed a health insurance chief executive in New York.
UnitedHealthcare boss Brian Thompson, 50, was shot in the back … [+1607 chars]","New York shooting: Images released in hunt for UnitedHealthcare suspect Skip to content British Broadcasting Corporation Home News Sport Business Innovation Culture Arts Travel Earth Video Live Home News Israel-Gaza War War in Ukraine US & Canada UK UK Politics England N. Ireland N. Ireland Politics Scotland Scotland Politics Wales Wales Politics Africa Asia China India Australia Europe Latin America Middle East In Pictures BBC InDepth BBC Verify Sport Business Executive Lounge Technology of Business Future of Business Innovation Technology Science & Health Artificial Intelligence AI v the Mind Culture Film & TV Music Art & Design Style Books Entertainment News Arts Arts in Motion Travel Destinations Africa Antarctica Asia Australia and Pacific Caribbean & Bermuda Central America Europe Middle East North America South America World’s Table Culture & Experiences Adventures The SpeciaList Earth Natural Wonders Weather & Science Climate Solutions Sustainable Business Green Living Video Live Live News Live Sport Home News Sport Business Innovation Culture Arts Travel Earth Video Live Audio Weather Newsletters New images released as hunt for New York shooter continues NYPD Crime Stoppers Police have released two new images of a suspect in the hunt for the gunman who killed a health insurance chief executive in New York. UnitedHealthcare boss Brian Thompson, 50, was shot in the back as he made his way to a conference on Wednesday, in what police believe was a targeted attack. On Saturday, city mayor Eric Adams said the ""net is tightening"" around the gunman, who has so far evaded police despite an extensive search and the use of facial recognition technology. The FBI has offered a $50,000 (£39,000) reward for information leading to the suspect's arrest. The latest images of the man being sought are both taken from a vehicle. In one, he can be seen in the back of a taxi wearing a hooded sweatshirt and a disposable face covering. In the second, he is seen outside of the car, again wearing a facemask. The new appeal came as US media reported a backpack thought to belong to the suspect recovered near the scene contained a Tommy Hilfiger jacket and paper money from the board game Monopoly. NYPD Crime Stoppers Thompson, a 50-year-old father of two, was shot as he made his was to an investor conference in Midtown Manhattan where he had been scheduled to speak later that day. Police said the gunman first fled the scene on foot, before riding a bike towards Central Park. The motive for the killing is still being investigated. Authorities have confirmed the words ""deny"", ""defend"" and ""depose"" were written on the bullet casings found close to the victim's body - language which could be associated with critics of the US's private health insurance industry. On Friday, a person familiar with the matter told CBS News, the BBC's US partner, that investigators believed the suspect was no longer in New York City and may have boarded a bus to the city of Atlanta in the state of Georgia. Killing of insurance CEO reveals simmering anger at US health system Who was Brian Thompson, healthcare CEO gunned down in New York? New York City Related What we know about NYC killing of healthcare executive 2 days ago US & Canada Judge in Daniel Penny case dismisses manslaughter charge 2 days ago US & Canada Daniel Penny faces new civil lawsuit while trial continues 3 days ago US & Canada British Broadcasting Corporation Home News Sport Business Innovation Culture Arts Travel Earth Video Live Audio Weather BBC Shop BBC in other languages Follow BBC on: Terms of Use About the BBC Privacy Policy Cookies Accessibility Help Contact the BBC Advertise with us Do not share or sell my info Contact technical support Copyright 2024 BBC. All rights reserved. The BBC is not responsible for the content of external sites. Read about our approach to external linking."
